5bc4bc24-6fee-486c-9068-b7616a662213,234943623,2020-12-08T14:24:41.823Z,2020-12-08T14:24:41.823Z,1,"攝影機也是 跟擺好看的一樣
之前機車不知道被誰撞
去調監視器也是跟我說故障
關於路燈真的感同身受
之前也有跟學校反應過
不過他們只說會再處理🙃",6,F
bfdf928d-43a2-4f63-a106-7a96e4020b85,234943623,2020-12-08T15:23:55.130Z,2020-12-08T15:23:55.130Z,2,B1 我有一次就因為沒路燈走路差點跌倒,1,F
7a6bb9d6-042b-4fad-a551-5dbcb2a2f268,234943623,2020-12-08T16:28:15.077Z,2020-12-08T16:28:15.077Z,3,現在這個時候打去教育部高教司投訴或是台南市教育局基本上對校方還是有點嚇阻作用，別常常因為省電就不開燈...，再不行就找民代，這是最好讓校方重視的管道。,2,M
da5559bf-33dc-4127-8d61-930dc97c9be9,234943623,2020-12-08T16:39:34.602Z,2020-12-08T16:39:34.602Z,4,"第三選區立委是郭國文，議員有民進黨籍吳通龍（首府校友）、陳秋宏、國民黨籍尤榮智。

不過這幾個議員我覺得不太會管學校事，可以找看看但沒用的話可以找第一選區議員李宗翰、七選區林易瑩、八選區沈震東陳怡珍、十選區蔡筱薇、十一選區郭鴻儀許又仁，這幾個議員是對教育環境比較有關注的議員，記者會開下去校方就不得不作為了。

永康那邊的立委林宜瑾記得本身就有在經營關心各個教師團體跟教育議題，也可以找他。",2,M
aa25e494-946d-4b3d-97d6-ffc30f78cadc,234943623,2020-12-09T03:25:57.962Z,2020-12-09T03:25:57.962Z,5,"每間學校都得等到出事才會正視，處理問題……
我也建議停車棚裝個監控，我朋友安全帽上次被幹走雖然之後有還回來，我在D卡看了文好像也有很多人的安全帽也被幹走過……😶😶😶",2,F
0570ccb5-dc9a-426b-84c2-7696dec3cdd5,234943623,2020-12-09T15:28:18.909Z,2020-12-09T15:28:18.909Z,6,"我常常在學校剛出來那個彎看到車禍 
不然就是在右轉後第一個紅綠燈看到警察在抓闖紅燈",1,M
3160976c-10f3-4e0c-9b2c-5e1e8bdd254f,234943623,2020-12-10T07:04:33.611Z,2020-12-10T07:04:33.611Z,7,"B6 最近倒是很少看到警察了耶🤔
上學期是真的每天看到😂😂😂",0,F
af60c663-e36e-422f-b54e-291d394c48cf,234943623,2020-12-10T13:14:37.037Z,2020-12-10T13:14:37.037Z,8,B7 可能天冷了 懶惰了,0,M
