234943243,"嗨那個大家好，我是今年的大一，
心情不好的時候會彈吉他唱歌，
最近很多事情都不太順利，
所以想找個地方彈吉他放鬆一下，
但是找不到地方盡情的唱和練，
宿舍住勝八隔音很差不敢在宿舍練，
也沒有參加什麼音樂性的社團，
知道有一些地方是很少人啦但是好暗我會怕，
所以想請問大家有沒有安全又不會打擾到別人的地方？",問 不會打擾別人的地方,2020-12-08T12:53:27.827Z,2020-12-08T12:58:53.691Z,28,11,F
234943196,"各位成大的學長姐好 
我借用我哥的帳號發文
小女子今年高三最近在準備學測
突然我哥問我要讀什麼系
我跟他說我想讀化學或護理系
他說三類醫牙藥 二類只有電資
其他都不太行
我心裡想這應該是他自己的偏見吧
因為我高中化學學的還不錯 
加上我自己數學不太好 
想說讀化學不用讀到數學
想讀護理系是因為以前看醫生的時候
看到護士的表情都像天使姐姐一樣 
我也想變成那樣的人QQ
不過最近又有點迷惘
化學老師上課的時候說讀化學只能當老師
可是那以後少子化 老師不就沒人當了？
想問一下各位學長姐的意見 謝謝
因為明年課鋼要改了 我怕選錯系不能重來@@",想問一下科系的選擇QQ,2020-12-08T12:46:39.490Z,2020-12-08T12:51:40.846Z,37,9,M
234943134,"法律這個小圈子
常常被理組嘴文組
更是常常被大眾唾棄
我認為我們應該要團結起來
彼此各退一步 
彼此再互鬥真的沒意義
應該要把炮口一致對外才對
如果在其他版看到又有人在戰北大(或東吳輔仁那些的)請馬上制止",勸各位法律的朋友們不要戰北大了,2020-12-08T12:37:07.634Z,2020-12-08T12:54:29.109Z,63,23,M
234943084,"可是有寒流喔嗚嗚嗚嗚
要不要去捐啊！
十月去拿了熊大口罩
https://i.imgur.com/0eMZD3e.jpg",下禮拜校園捐血送這個,2020-12-08T12:28:50.596Z,2020-12-08T12:28:50.596Z,7,5,F
234942885,"爬過蠻多文的，可是都發現至少要1公里以上QQ小妹我只有腳踏車...
大家有私藏什麼成大附近的健康餐盒嗎？",成大附近低卡健康便當？,2020-12-08T11:54:13.281Z,2020-12-08T11:58:25.319Z,16,2,F
234942774,小弟剛好錯過申請寒假留宿的最後時間，剛剛去問宿委會的同學他說不能補了，想問還有沒有什麼其他方法可以申請，或是東西直接放著不收讓他補繳錢這個方法可行嗎？ 感謝各位🙏,！補申請寒假留宿！,2020-12-08T11:37:21.456Z,2020-12-08T11:37:21.456Z,12,3,M
234942710,"我是里長 這篇算是奇聞共賞

就在剛才下課不久，我要到社科院停車場騎車的時候看到

停我我右邊的車立側柱鎖龍頭，還直接貼在我車上
停我左邊的偉士牌，近到我的手指都插不進去

我把旁邊的車稍微移開之後，用爬的爬上車準備要騎出來

淦！前面那一台車的車牌居然直接貼在我的前輪

我要怎麼放中柱？？？？？？？？？？？？？

勞資直接拿出筆記本幹譙一串之後貼他車上，然後移了兩台車才出來

真的是幸好旁邊有監視器，不然我真的不知道會對他的車做什麼事🙃

現在是在玩機車多p嗎？還是在打麻將
三咖打我一咖淦

不會停車就不要出來丟人現眼好不好
勞資都已經請學校增設那麼多停車位了好好停車很難嗎

希望大家不要遇到這種爛人 也不要變成這種爛人

破壞我吃三媽的好心情🖕🏻",不會停車不要出來丟人現眼,2020-12-08T11:27:29.918Z,2020-12-08T11:35:01.540Z,9,10,M
234942405,"同學，你的學生證掉了，等下會把它放到光復校區門的警衛室那裏，記得明天要去取呀
https://i.imgur.com/GMK5IA4.jpg

外面好冷，多穿件衣服",育樂街撿到學生證一張,2020-12-08T10:35:31.567Z,2020-12-08T10:35:31.567Z,7,4,F
234942023,"16周18周各有利弊

與其在那邊辯來辯去

直接來統計看看比較快

在下面留言的地方統計一下吧",來統計一下 是否支持縮短周數,2020-12-08T09:35:20.462Z,2020-12-08T09:37:56.722Z,9,5,F
234941532,"剛剛回宿舍看到勝九門口有救護車跟一位警察，是有學生怎麼了嗎Σ(°Д°;
這學期事情很多，突然有救護車看了有夠怕",勝九外面的救護車,2020-12-08T08:09:55.162Z,2020-12-08T08:09:55.162Z,6,10,F
234940898,"自己想放的自動放假吧,16周妳能把必修科目有系統性的學完嗎？","想放的自動放假吧,不要影響要唸書的人",2020-12-08T06:09:20.763Z,2020-12-08T06:09:20.763Z,16,45,M
234940832,剛剛過了退選日期，小弟這學期也是退了幾門課，好奇大家每學期平均都修幾學分呢，我已經工院大三了，曾經最高25學分沒有退，這學期退到剩18學分嗚嗚,大家每學期的學分,2020-12-08T05:58:34.015Z,2020-12-08T05:58:34.015Z,15,6,M
234940821,"最近心好累..
1.停在停車場也能被車被撞到
2.騎車掉到田埂裡
3.通識明明都很認真，可是還是回天乏術
4.期末好多報告擠在一起，有一堆功課，根本沒時間去做報告
5.微積分、普化、工圖已經很努力了，考出來都及格而已
6.想找人聊聊，但又沒有人是真心想聽的

總之被這些事情弄得已經自律神經失調，想睡也不能睡，能睡的時候又睡不著，壓力好大，1000atm，我真的好累好累，最近走在路上常常頭暈目眩，感覺下一秒會無力地暈倒，所以出口在哪...

我知道有人會說有時間打這個，不快點讀書，但我真的盡力了，我真的...累了...",出口，在哪..,2020-12-08T05:56:07.438Z,2020-12-08T15:40:59.315Z,14,15,M
234940335,"交大 陽明已經改每學期16周了

台大系統的台大 台科 台師大也準備改16周了

身為頂大一員的成大什麼時候才要跟進啊",成大什麼時候才要改成16周,2020-12-08T04:19:52.495Z,2020-12-08T04:19:52.495Z,93,79,F
234940113,"我很喜歡唱歌！但我唱的不好聽，喜歡聽別人唱🤪
之前有查到不分系跟台文系兩個可愛女生的翻唱，都唱的好好聽！而且其中一個還是YouTuber啊啊啊超可愛👀
所以想問有沒有推薦唱歌很好聽又有在翻唱的同學呀～好想搜集😆

像去年畢業歌那兩個女主唱聲音都超好聽的！！！（而且顏值又高🤤）
不知道她們有沒有在po唱歌的影片呢？",想找成大會翻唱的同學🥰,2020-12-08T03:29:19.750Z,2020-12-08T03:29:19.750Z,16,10,F
234939698,"如題
我雙主修的系之前門都開的
今天突然關起來了
我的卡也沒有權限
後來是工讀生幫我開的
問工讀生他說以後都會關起來
所以我每次進去只能叫工讀生幫我開嗎？
還是可以問看看誰能不能幫我開他們的權限",雙主修的人都怎麼進去系館的,2020-12-08T01:35:31.917Z,2020-12-08T01:35:31.917Z,5,16,F
234939642,"大家好 期末將至
我訂了兔田佩可拉的胸部滑鼠墊
可是我現在不知道要送到家裡 還是送到租屋處==
送到家裡可能會被家人看到 = 家庭性死亡
送到租屋處可能會被管理員看到 = 社會性死亡

請問有沒有人方便代收 讓我能保全這條性命==
謝謝 可以讓你用一次",有沒有人能代收胸部滑鼠墊==,2020-12-08T01:13:19.926Z,2020-12-08T01:13:19.926Z,20,14,M
234939280,"如題
想問一下點名的15%是有到姆嘟點簽到/退
就拿ㄉ到的嗎ಡ ͜ ʖ ಡ
小妹窩懶得寫心得了啦╰(⸝⸝⸝´꒳`⸝⸝⸝)╯",通識領袖論壇,2020-12-07T20:01:45.927Z,2020-12-07T20:01:45.927Z,2,2,M
234939151,"每次考完試又有數不清的進度要追
有些科也還沒考完
尤其期末將近
課業量異常大
我感覺我快被壓垮了
睡眠品質奇差無比 唉",要怎麼每天睡得安穩,2020-12-07T18:58:17.904Z,2020-12-07T18:58:17.904Z,11,18,M
234938886,"如題 剛剛洗澡都沒熱水
不是供應到2點嗎😭😭
有沒有勝八的朋朋也這樣",勝八熱水,2020-12-07T17:47:05.374Z,2020-12-07T17:47:05.374Z,8,7,F
234938655,"救命ㄚㄚ

他的 HW3 report 是要寫什麼，把那些額外嘗試都做一遍然後寫成報告嗎QQ

小弟期末同組的寄信都沒人要回所以沒人可以問，剛剛才想到有低能卡可以問

但明天就 DL 了是不是該上香了

https://i.imgur.com/5MEbC2i.jpg",高宏宇 人工智慧於醫療應用服務 請進Q,2020-12-07T17:05:08.990Z,2020-12-07T17:05:08.990Z,12,3,M
234938498,整排都聽的到你們鬼吼鬼叫的聲音，是不是想被退宿，沒關係我們已經錄影了，明天準備收拾東西,光一323到底在吵三小,2020-12-07T16:39:30.065Z,2020-12-07T16:39:30.065Z,12,8,M
234938497,"想問有沒有人看過西門路上的參神堂中醫？
網路上資料太少 想問一下有看過的人的評價～感謝🙏🏻",問中醫評價,2020-12-07T16:39:21.465Z,2020-12-07T16:39:21.465Z,3,1,F
234938404,"https://i.imgur.com/9BDk1BX.jpg
一個講座要繳1000字的心得 一般1積分 寫的好90分以上才會2積分

通識教育生活實踐學分要9點才能抵1學分

等於如果我作文很差 心得寫不好
我要寫18個心得 總共一萬八千字才能抵一個通識的2學分",通識生活實踐學分CP值也太低了吧,2020-12-07T16:25:48.329Z,2020-12-07T16:25:48.329Z,13,4,M
234938257,不知道什麼時候很多人都開始使用妹子這個詞，尤其男生之間在聊天更常講到，不曉得女生聽見自己被別人叫妹子會不會感覺不被尊重？,女生聽到自己被叫妹子會感到不舒服嗎？,2020-12-07T16:02:37.646Z,2020-12-08T10:00:13.844Z,39,19,M
234938251,"如果你的企業業師很沒熱情的話，你會覺得在浪費時間，業師也只會安排五次上課而已，還有企業參訪一次，學不學的到東西，見仁見智吧！

然後，當然要大力抨擊開幕式跟閉幕式，完全不懂浪費一整個下午拍手有何意義，而且不去不能結業，你會被要求去看錄影帶，哈哈哈沒錯，就像補習班補課一樣，只不過你是看長官跟慧貞講話！",CCP慎選企業,2020-12-07T16:02:01.954Z,2020-12-07T16:02:01.954Z,4,4,M
234938005,"這間真的是育樂街之恥欸！ 說實話 除了清炒和青醬還可以，其他真的完全不行欸！千層麵真的只能當點心，完全吃不飽啊！而且價位真的性價比很高，貴鬆鬆，真的好奇平常時候有其他人會光顧嗎？除了飲料大杯和炸物還可以，乾脆把店收了開飲料店吧！

以前就有聽學長姐說過這間很雷，啊想說去吃看看，結果第一次去就遇到蟑螂（本人真的超怕蟑螂！不管店優不優，有小強就是差評！😤）啊娘喂，還很多隻，真的可以舉報衛生局了！而且店裡的歌單又老又一直死循環，真的快聽瘋了，之前有在播《刻在》的時候，我還心想 哇！總算難得跟上潮流了，結果過沒幾天又是那幾首老掉牙的歌曲

要說這間店唯一的好處可能就是適合讀書可以充電，本來想說地方安靜一點可以讀書，結果有個短髮大媽店員在那邊嚇嚇叫！講話好像要打人一樣！真的是吵死了😖想好好讀書都不能，她的叫聲真的絕了，戴耳機都聽得到😒，明明好像是自己惹的禍還要賴其他店員似的！

我看被罵的店員挺好的啊！有禮貌而且之前我要他幫我把飲料換外帶而已結果也被罵，好像是因為裝錯杯子而已，結果大媽就把他推開，我真的超傻眼🙄！

食物不優、衛生不優、那個大媽也不優，真的很好奇 那個大媽是怎樣做到現在的🤔？是不是連鎖店都比較難倒閉啊？我有看過其他地方的門店評價都比較偏貶，我真的認真提議他們真的應該認真檢討內部欸，菜色份量也是，店員服務也是（認真覺得大媽應該退休了）

希望這家店真的不要砸爛自家招牌欸，多學學街尾好煮意，人家店小可是價格親民，打卡還有優惠，有雖然沒有其他飲料 沒有點心 但總體感覺還是比這家好太多了",育樂街之恥🤬— 「NO」58,2020-12-07T15:31:28.360Z,2020-12-07T15:31:28.360Z,13,19,M
234937837,"原po是我室友
https://i.imgur.com/Y2B7VTx.jpg
他自己很清楚去過哪裡 也知道沒有搞丟
但以防萬一他也有到曾經去過的地方問問 
也在警察局立案了
但其實當天有發生一件弔詭的事：
https://i.imgur.com/sKqXSxF.jpg
（圖中碼掉的是常常來我們房作客的人 但當晚那人講的話跟行為我們確定不是那位朋友 但特徵有像）
在宿舍打麻將偏吵我先跟各位道歉
但是當天我們打到凌晨1.多 那天也沒有太多喊叫
我出門至清晨回來就發生了這件事
覺得有點奇怪 
不願去想是不是被偷的
更不想去懷疑誰
但如果真有此事
麻煩把東西還來
現在他要回香港已經很麻煩 
更何況要在學期中回去 還要重辦什麼東西的
是沒有必要造成別人那麼多困擾好嗎...
拜託良心發現 別太無聊了",協尋錢包,2020-12-07T15:06:45.181Z,2020-12-07T15:06:45.181Z,8,8,M
234937353,"弱弱問一個
這個舞會是正裝的
去的男女比會懸殊嗎
會不會都是男生..
還有要交談或是搭訕
有什麼撇步
酒跟食物應該無限吧？",Freesia舞會,2020-12-07T14:05:15.924Z,2020-12-07T14:06:16.060Z,10,9,M
234937350,"自從兩次期中主科都沒考好後GPA不夠推
就決定乖乖考研了= =
寒假報補習班囉",推甄轉考研的心路歷程,2020-12-07T14:05:09.128Z,2020-12-07T14:05:09.128Z,1,3,M
234936327,"觀望成大的ccp計劃很久了，今年報名了組員
也努力填寫了報名表內容
今天公佈了之後 發現自己沒有上想要的前幾志願
甚至是跟我科系不太相關的領域
不太知道該開心還是什麼心情
可能我填寫的不夠好 大家都很厲害呢
一時之間有點不知道如何面對🤕
也有點怕進去變成對這領域什麼都不懂的人
但還是期待這個計劃！",錄取了但不知所措,2020-12-07T10:58:42.285Z,2020-12-07T10:58:42.285Z,10,12,F
234936229,"兒歌「只要我長大」中有一句台詞說

   當兵笑哈哈~


















當兵還要笑
太殘酷了吧！",只要我長大,2020-12-07T10:37:19.516Z,2020-12-07T10:37:19.516Z,3,6,F
234935831,"每次滑二手版，都會看到一堆親友團在文的底下幫忙推衝人氣
可是自己真的沒什麼女生朋友....QQ所以也找不到人幫忙代發文
很害怕po文賣東西卻完全沒人理會....
好邊緣好無助QQ還是繼續吃土過日子好了...",不敢在美妝二手版發文...,2020-12-07T09:20:05.208Z,2020-12-07T09:20:05.208Z,18,17,F
234935760,"之前跑活動結果莫名其妙被根本不熟的人在背後說三道四
講的好像我真的是那樣，讓很多人對我產生先入為主
我不懂為什麼對方能在根本沒交談過不熟的情況下這麼討厭我
後來發現根本是“曾經的”朋友在背後搞事
嫉妒我就到處跟不熟的人靠北我
然後在我面前又裝的很在乎我的感受一樣
真噁心嘔嘔嘔嘔嘔嘔嘔
希望她們這種人都去聽聽王心凌的
“劈你的雷正在路上”
2020快結束了還是小心做人吧🙂",劈妳們的雷正在路上,2020-12-07T09:05:45.516Z,2020-12-07T09:13:04.020Z,8,32,F
234935732,"上星期買的時候
賣家有私訊我說
“親，貨到了麻煩您及時取件”

突然想起來
親
這件事
而且當初我也沒看賣場評價
害我覺得怕怕的
明明寫台灣出貨

然後我剛剛想回去看評價
卻發現賣場已經被停權或刪除了
😱😱😱😱😱
怎辦
我有點想不敢吃了
怕遇上仿冒品
可是一瓶也700多欸

如果是你們還會吃嗎😱😱😱😱",蝦皮買保健食品,2020-12-07T09:00:42.433Z,2020-12-07T09:00:42.433Z,3,2,M
234935517,"請問有人知道應用電學第三次演講是幾號嗎～
開學那時候好像還沒確定
謝謝大家！",應用電學,2020-12-07T08:20:03.724Z,2020-12-07T08:20:03.724Z,1,0,F
234935150,"聖誕節快到了
多了許多交換禮物的活動
這對送禮障礙的人來說真的有點困難
可以請問大家會喜歡/討厭收到什麼禮物嗎
（不論男女）",交換禮物,2020-12-07T07:15:20.080Z,2020-12-07T07:15:20.080Z,13,3,M
234934425,"這是我在成大的第一年，一開始時是各種的期待與興奮
讀了快半個學期，學業上沒有遇上太大的問題
只是身體真的撐不住了，從9月到現在也不知道跑了多少次醫院，然後中間也小病大病過，一直以來身體都比較差，可是在家的時候，生病了都有家人照顧，基本上很快就會好起來。
這幾個月在這裡無論是醫院檢查、做手術都是一個人，在房間痛到下不了床也是一個人...心理和身體都很難受...小病也要拖兩三天才會好，跟助教請假都請到不好意思了...
今日終於決定先休學，讓自己的身體先回復
本來想撐到這學期完結的，因為不想拖累到Group project的組員，擔心自己突然退出會令他們的工作量加重，更不想被其他人覺得不負責任，可真的很抱歉，我已經盡力了😞

希望大家期末考都考到好成績，秋冬的天氣很容易會情緒低落，但願大家都不受影響，開開心心享受大學的生活",最後還是休學了,2020-12-07T05:04:55.588Z,2020-12-07T05:04:55.588Z,31,302,F
234934408,"如題，我不太清楚林耀璘教授的文言文作業規定😢
是多少字然後什麼形式（文類）還有期限
😢",歷代文選及習作 作業,2020-12-07T05:01:45.978Z,2020-12-07T05:01:45.978Z,1,0,F
234934313,"https://www.google.com.tw/amp/s/udn.com/news/amp/story/7323/5072328

現在青山宮遶境吵很兇

阿讓我想到成大每年也都有一個擾民遶境活動

從系館吵到宿舍

提出抗議
得到的回應內容跟那些宮廟8+9一樣
什麼一年才一次 傳統文化啥的ㄏ

有沒有成大素質其實跟垃圾宮廟仔差不多的卦",成大水準跟宮廟仔的差距,2020-12-07T04:45:13.026Z,2020-12-07T04:47:06.772Z,8,22,M
234933554,如題，爬文看到有些人說找管理員，有些人說找宿委，請問是兩方都可以嗎？最近快被鄰房的吵到受不了了。,宿舍檢舉找誰？,2020-12-07T02:11:50.776Z,2020-12-07T02:11:50.776Z,5,3,M
234933437,如題，在下不小心感冒惹，求有經驗朋朋推一下成大附近診所(發燒不蘇服，我不敢不吹頭髮惹),不小心感冒惹,2020-12-07T01:40:51.159Z,2020-12-07T01:40:51.159Z,2,1,M
