234982649,"如題
我去你的猴子 最好半夜吵 白天睡覺 期末被21
https://i.imgur.com/nYKr7PX.jpg",歡迎被吵到睡不著ㄉ朋朋進來取暖,2020-12-14T16:17:52.788Z,2020-12-14T16:17:52.788Z,5,2,M
234980154,大家騎車經過居安樓後面的停車棚那一條路時，麻煩大家放慢騎車速度還有可以注意看一下路上，那邊本來有三隻貓咪，前幾天有一隻死掉了😢不知道是不是被撞到。謝謝大家🙏🙏,麻煩大家注意🙏,2020-12-14T10:39:27.431Z,2020-12-14T10:39:27.431Z,6,6,F
234978948,"https://i.imgur.com/pTSxVs9.jpg
這個放在原教室的講台上 再自己去認領一下",撿到AirPod 盒子,2020-12-14T07:17:46.510Z,2020-12-14T07:17:46.510Z,0,3,F
234978722,"下午14:29，在視聽2的那群男生
你知道你們的笑聲比大聲公還大聲嗎？
是想引起誰的注意？老天爺哦
來看電影勢必是想好好休息放鬆的，硬生生被你們的笑聲整到不爽🤨你們是以為視聽室之間的隔音很好嗎？全程都聽到你們笑的比喇叭還大聲，談論聲音也超級大
可以麻煩你們尊重一下別人的權益嗎？
https://i.imgur.com/VnLlFal.jpg",圖書館五樓看電影的地方,2020-12-14T06:36:05.976Z,2020-12-14T06:36:05.976Z,8,5,F
234978088,"沒有要公審 下次注意一下
講到爛的側柱 也要注意一下有沒有碰到旁邊的車
殼剛換 心很痛
在後山停車場樓梯口
https://i.imgur.com/EQfUCFM.jpg
https://i.imgur.com/WMLQy1A.jpg",後山停車,2020-12-14T04:29:19.287Z,2020-12-14T04:29:19.287Z,1,10,M
234977500,"https://i.imgur.com/tIGDAbL.jpg

現在已經轉交給生輔組了 要自己去認領哦～",學生證遺失,2020-12-14T02:22:12.141Z,2020-12-14T02:22:12.141Z,4,3,F
234976659,"請問市面上哪一款蟑螂藥比較有效呢
每次都因為蟑螂緊張到一直流汗睡不著😑
這邊請各位幫個忙謝謝",蟑螂,2020-12-13T18:25:42.487Z,2020-12-13T18:25:42.487Z,9,3,M
234976582,"當初住宿前就是想說不要共浴所以才甘願付多一點錢住4樓的
我們宿舍有空床 結果就發現有學姐帶五樓的朋友下來晚上1點多都還沒回去 不知道是不是睡這了 
而且平常他還會在我們這洗澡 要洗澡還要等他用完才可以去洗
嗓門超大 有事沒事就給我鬼叫 早八還在睡被吵 下午回來睡被吵 半夜還在吵 真的很傻眼欸
不知道這樣子能不能請人處理 
已經一陣子了真的很擾人",回去5樓好嗎？,2020-12-13T18:09:32.052Z,2020-12-13T18:09:32.052Z,2,5,F
234976524,第一次在宿舍晚上聽到有人施工的聲音(？)，哇塞，現在是半夜欸怎麼可以那麼吵，有多少人是被吵醒的？,今天晚上是在吵什麼,2020-12-13T17:57:45.873Z,2020-12-13T17:58:32.870Z,4,2,F
234976406,幾乎沒什麼人上山，很少人爬，滿滿的落葉，爬上去後會覺得有點陰森，自己曾有一個人攻頂上去過，中間的路有點陰森，陽光照不到，發現樂達利山莊的山幾乎很少人爬，雖然這沒紅衣女孩，但晚上時候是最陰，曾經還跟同學們在晚上時玩遊戲，輸的人走階梯，走到階梯的頂端通往山區入口，有趣的是上去陰森入口又衝下來，靠近入口時，當下覺得毛毛的，感覺有髒東西在附近.... 感到不舒服,有人爬上去學校山的頂點嗎,2020-12-13T17:34:25.743Z,2020-12-13T17:41:51.277Z,2,3,M
234960708,"https://i.imgur.com/704QWgT.jpg
在正門停車場撿到，已拿去二樓生輔組。",隱眼遺失,2020-12-11T05:18:21.715Z,2020-12-11T05:18:21.715Z,4,2,M
234960248,"2501教室掉了一個耳機，是用大象零錢包裝，已交耕書二樓生輔組。
https://i.imgur.com/akeH63N.jpg
https://i.imgur.com/ZoTm2hF.jpg",耳機遺失,2020-12-11T04:04:51.330Z,2020-12-11T04:04:51.330Z,0,4,M
234959741,"研宿我不知道  但居安樓的宿舍自治會裡面的成員很多都是低收 曾經有同學告訴我他們一學期大概要累積30小時吧 就能免住宿費  

這去生輔組的網站就查的到 

班上如果有宿舍自治會的會長啊 幹部啊之類的
你們自己問是不是低收 雖然他們不會承認ㄏ

發這文沒有別的意思啦 只是有人想知道怎麼免住宿費我才回答的 沒有要針對誰 

學生宿舍自治會也很可憐的 不能參加正常社團 還要打掃點名 晚上11點幫大家點名後才能回自己宿舍
QQ",關於宿舍自治會的人,2020-12-11T02:17:13.799Z,2020-12-11T02:17:49.650Z,16,13,M
234959526,"在垃圾場旁邊的停車場撿到的 送到生輔組了哦～
上面還有紅色的磁扣
https://i.imgur.com/szOZRnZ.jpg",撿到鑰匙,2020-12-11T00:55:43.971Z,2020-12-11T00:55:43.971Z,0,5,F
234959192,"宿舍自治會的成員大多都是低收
所以才會被叫去自治會 可以抵住宿費

沒錢繳幾千塊的住宿費QQ
然後口氣那麼差還敢管別人 
看來是窮到只能用聲音來壯膽了ㄏ

更新
自治會的開始森七七了

自治會的確很多都是低收啊 
我同學就是自治會的 參加自治會累積時數的確可以免住宿費啊 不會自己去問生輔組？？？

啊不然有正常社團 他們幹嘛不加 然後還要待到晚上11點點完名才能回宿舍 zzzz還不是因為學校叫他們做事情才能免錢",關於宿舍自治會,2020-12-10T20:07:22.538Z,2020-12-11T03:05:00.179Z,41,16,M
234958891,"今天已經有三個地震了，住宿睡上舖的話要怎麼避難啦😫
怕太搖很難爬下去欸",地震,2020-12-10T18:23:12.278Z,2020-12-10T18:23:12.278Z,8,4,F
234957668,"https://www.dcard.tw/v2/vivid/videos/b3a07ad6-9947-4d0e-bb0e-f12767a7c9b5?r=1.797752808988764
你怎麼這麼可憐啊啊啊啊🥺你給我下來🥺",啊喔,2020-12-10T15:28:02.105Z,2020-12-10T15:28:02.105Z,61,38,M
234955903,"https://i.imgur.com/kYpnFK1.jpg
在天機B2大禮堂撿到
明天請到生輔組領取～
還請同班同學有看到幫忙告知一下
感恩",失物招領,2020-12-10T11:34:01.801Z,2020-12-10T11:34:01.801Z,1,4,F
234955154,"到底怎樣停車可以把兩顆安全帽弄掉在地上？弄掉在地上就算了，還不撿起來，一張道歉紙條都沒有，似乎還尻到後扶手🤷🏻‍♀️ 有沒有好心人看到是誰做的...

https://i.imgur.com/jEh0IJ9.jpg
https://i.imgur.com/XoTKvHM.jpg
https://i.imgur.com/TWhPN6F.jpg",前門停車,2020-12-10T09:28:42.017Z,2020-12-10T09:28:42.017Z,1,8,F
234954542,"學校因為評鑑教室沒開也沒提早說 
讓一堆人白跑一趟？
也讓很多人少一次的練習 這樣是學生的權益損失吧？
這樣子是不是每次要練習都要打電話去學校問？
https://i.imgur.com/BlQyHiN.jpg",學校因為要評鑑,2020-12-10T07:42:06.831Z,2020-12-10T09:18:29.052Z,68,11,F
234954346,"想收這學期的汽車車證，但是只需要在寒假期間使用🥺
因為寒假需要有幾天開車來學校，只有寒假而已希望可以不要太貴😞",寒假的汽車車證,2020-12-10T07:05:32.263Z,2020-12-10T07:05:32.263Z,10,1,F
234953356,我想問牙技的同學，因爲下學期我轉系到牙技，所以我想問，妳們買的NlsslN牙齒模型買新的時後多少啊，我需要做參考我想買二手不想被欠謝謝🙏請大家幫幫我，我沒牙技同學可以問,牙技問題～～,2020-12-10T04:15:25.477Z,2020-12-10T04:15:25.477Z,22,3,F
234952724,"我知道真心想唸書的話去K書中心比較好
但因為有想參考的書，所以才來圖書館
（書很厚、沒有要看很久，只是拿來比對而已）

如果是氣音小聲聊也就算了
不帶口罩還一直狂咳嗽= =
有夠可怕.

雖然很快就離開這個位置去其他地方繼續唸了
但還是想說 同學 整個圖書館不是你的聊天館🙄🙄
隔個3、5秒就在咳嗽還硬要聊天
進來圖書館戴口罩是只戴給櫃台看嗎？？😡😡😡
https://i.imgur.com/DyztE5g.jpg",可以不要在圖書館聊天聊那麼大聲嗎？,2020-12-10T01:58:41.200Z,2020-12-10T01:58:41.200Z,6,6,F
234952547,"剛剛八點出頭的時候
我騎在要往蝴蝶橋的路上
我只是``稍微``往中間黃線靠近等綠燈而已「還在黃線內沒超出來」
你就從右邊方向騎出來，載著女生還壓車過彎差點撞到我！！
這也沒什麼反正沒撞到都沒事！
重點是！
我回頭看你的時候你竟然有臉跟我比中指？？哇靠！！是再哈嘍？？我在線內欸！
你騎車技術不好就慢慢騎啊，載女生還壓車，真是笑死人

要不是我要上班
 不然絕對追上去問你是中指在比什麼意思的",騎黑色jet的死屁孩,2020-12-10T00:52:54.419Z,2020-12-10T00:52:54.419Z,17,19,M
234952516,"https://i.imgur.com/jB7Vevl.jpg
你鑰匙沒拔
幫你用安全帽壓在腳踏板上面了喔",鑰匙幫忙收起來了,2020-12-10T00:36:30.265Z,2020-12-10T00:36:30.265Z,3,3,F
234952163,"最近看學校文章都是居安樓的很吵
想到以前還住宿的時候也是這樣...
當時隔壁房住學姊，
還記得那天晚上11點 她們真的太吵了
然後我們就去敲門請她們降低音量
結果學姐們的態度就是：喔 抱歉ㄛ～
（然後隔音很差就能聽到她們一直狂罵我們）
一點都不尊重人欸^_^

還曾經有女生大號在淋浴間⋯⋯⋯
那天早上的打掃阿姨真的很可憐🥺

現在搬出來外面似乎也沒比較好
以前還有美麗會管，
現在遇到很吵鬧的都只能放任他了
因為你會發現投訴也沒什麼用。

希望不管是住宿或是租房的人都能自律一點
請以不影響他人為重^_^",素質越來越差,2020-12-09T19:28:17.529Z,2020-12-09T19:28:17.529Z,8,13,F
234950947,"有沒有五樓女宿洗手台裡有保險套的卦？
https://i.imgur.com/NMmRutS.jpg",洗手台有保險套？,2020-12-09T15:44:53.941Z,2020-12-09T15:44:53.941Z,10,1,M
234950663,請問明天早上8:20 牙技3乙的法律課是停課一次嗎！,法律課！牙技,2020-12-09T15:10:28.957Z,2020-12-09T15:10:28.957Z,5,1,F
234950482,"中臺素質真的堪憂
到底還有多少台車跟這個08一樣
下雨天，停車格又小
到底要害多少人？
撞到又特別會哭夭的那種
自己請好好愛惜自己的車好嗎！
龍頭請擺好
學學旁邊的很難？
https://i.imgur.com/F18XCuI.jpg",停車場龍頭請擺好,2020-12-09T14:48:18.362Z,2020-12-09T14:48:18.362Z,38,7,M
234950470,"跟同學走下來 
垃圾很多有一般有資源回收
時間也才10:30
什麼叫做要出示學生證還要填單
阿請問我遺失學生證 
可以出去嗎？
問我們要去哪裡 拿著垃圾當然是丟垃圾啊
不然把你丟掉喔？
你這樣管可以 臉可以不要跟大便一樣臭嗎？
請那些管理人員不要太囂張 你哪位啊！
門禁時間11點 你現在攔什麼···",門禁11點,2020-12-09T14:46:41.148Z,2020-12-09T14:46:41.148Z,68,32,M
234950337,"居安樓三前的各位
洗有殘渣或洗碗的麻煩到茶水間
廁所那邊是大家都在洗衣服的地方
你會想洗衣服的時候都是殘渣拌在衣服裡面嗎
麻煩將心比心一下
謝謝",麻煩洗東西在茶水間,2020-12-09T14:27:34.350Z,2020-12-09T14:27:34.350Z,3,7,F
234947085,怎麼晚上都沒開了變得好少營業是為什麼呢,魚丸伯,2020-12-09T05:19:06.455Z,2020-12-09T05:19:06.455Z,6,3,M
234945824,請問轉系考口試大概都問什麼問題？口試時間會很久嗎？大概多久,轉系考口試,2020-12-08T23:32:14.880Z,2020-12-08T23:32:14.880Z,2,2,F
234945499,"班上一堆人說 快跨年終於可以好好去玩了


哈哈哈笑死等級13級的私立學店平常有讀書壓力？
哈哈哈哈 不管有沒有跨年 你們每天都很嗨啦

私立學店每天都是連假 YAYAYA
大家嗨起來 我們就是爛 哈哈",快跨年了,2020-12-08T18:43:02.148Z,2020-12-08T18:43:35.743Z,3,7,M
234942112,"同學～
已經幫你把學生證拿到進修部學務處在耕書樓第二窗口
https://i.imgur.com/8VcEuce.jpg",學生證遺失,2020-12-08T09:46:55.077Z,2020-12-08T09:46:55.077Z,2,2,F
234941991,剛剛在側門攔截我問包包哪裡買的小姐姐，我忘記跟妳說了，在蝦皮打英倫包就可以找到嘍！,被攔截問包包哪裡買,2020-12-08T09:30:29.681Z,2020-12-08T09:30:29.681Z,0,3,F
234941286,此篇文章為轉貼文章，請更新至最新版本觀看完整內容。,妳自己也要負一半責任,2020-12-08T07:18:16.928Z,2020-12-08T07:18:16.928Z,5,12,M
234940338,"https://i.imgur.com/UVn9Hzk.jpg
https://i.imgur.com/xhOKjo6.jpg
空白空白空白空白空白空白空白空白",誰家的石虎？,2020-12-08T04:20:11.075Z,2020-12-08T04:20:11.075Z,7,8,F
234939539,"https://i.imgur.com/dRk8hAk.jpg
下次記得關喔！不然真的會沒電到推發也發不起來",下次記得關電 不然發動會沒電,2020-12-08T00:22:25.638Z,2020-12-08T00:22:25.638Z,6,11,M
234939509,"請問有人知道轉系考考的英文大概都考甚麼嗎？
可以從哪裡複習",轉系考英文,2020-12-08T00:03:42.897Z,2020-12-08T00:03:42.897Z,3,1,F
