234980529,各位物理系的大大，想問一下李進榮老師人如何，最近想加簽他的課，他的課會給加簽嗎,物理系李進榮老師,2020-12-14T11:46:15.661Z,2020-12-14T11:46:15.661Z,0,0,M
234980080,"https://i.imgur.com/A1c51ij.jpg
〔記者蔡宗勳／嘉義報導〕登革熱目前沒有特效藥和有效疫苗，中正大學研發團隊從預防醫療出發，發想新型登革熱病毒檢測試劑，希望可以有效提高檢測試劑的耐溫程度、降低保存門檻，並在30秒得到檢測結果，所研發的試劑原型參加美國國際基因工程生物機械競賽（iGEM）奪獎，揚名國際。

「登革熱是一個沒有辦法根除的疾病，這個疾病看似很小，實際上爆發起來卻相當嚴重。」中正大學iGEM團隊成員黃湘雁說，登革熱目前沒有特效藥或疫苗，只能仰賴醫院給予緩解症狀的支持性療法。

台灣近2年約有500至600個登革熱病例，在2014、2015年更爆發前所未有的登革熱大流行，造成6萬多人感染、200多人死亡，而全球則將近39億人口處在登革熱的影響範圍，足見登革熱在傳染病上的嚴重性。

中正團隊研發「新型登革熱病毒檢測試劑」原型，用3D列印製作試劑盒外殼，如同驗孕棒，只要血液樣本滴入試劑盒的一端，與試劑的奈米金結合後流到測試線，如果含有病毒，試劑就會呈現兩條紅線，而且有別於一般市面上的登革熱快篩試劑利用抗體做檢測，中正團隊開發的試劑原型則利用「多肽鏈」直接檢測登革熱病毒。

目前登革熱檢測方式大致有兩種，傳統核酸檢測需要數小時才能得知結果，而市面上的試劑則需要30分鐘，陳珏翰表示，目前中正團隊開發的試劑原型經過實驗測試，從滴入樣本到顯示結果約30至60秒即能完成，希望能加速篩檢，為病人爭取治療時間，也能及早做預防社區傳染的措施。

https://i.imgur.com/YUjHlLo.jpg
中正大學學生團隊用3D列印製作登革熱檢測試劑盒外殼，如同驗孕棒，只要血液樣本滴入試劑盒的一端即可得知結果。（中正大學提供）",30秒快速偵測登革熱 中正大學團隊研發揚名國際,2020-12-14T10:26:37.905Z,2020-12-14T10:26:37.905Z,1,5,M
234980034,"從上個學期就這樣了，人從來沒來過念書，結果別人的東西都被清理掉了，為什麼這兩格沒有被清呢???

https://i.imgur.com/dRbjSLC.jpg
https://i.imgur.com/dVcqloN.jpg",法院自習室,2020-12-14T10:14:43.223Z,2020-12-14T10:14:43.223Z,5,5,F
234979294,"發現今天(12/14)晚上到明天(12/15)清晨有雙子座流星雨（往東看）！
本來想和朋友去垃圾橋或圖書館羽光之丘
但是新聞上專家建議到2000m以上的高山
想問有沒有人知道學校附近（開車1小時以內）適合看流星雨的地方～
謝謝🙏",求問 中正附近適合看流星雨的地方,2020-12-14T08:13:05.701Z,2020-12-14T08:13:05.701Z,8,1,F
234979044,"請問這堂課有說期末是什麼時候嗎？ 
謝謝🙏",#問 國內外情勢分析,2020-12-14T07:34:31.278Z,2020-12-14T07:34:31.278Z,1,0,F
234977000,"沒注意退選的日期，就這樣錯過退選的時間

期中考前是全勤，不是到會被當的分數，是期末太多科目報告考試擠一起，會負荷不來，決定把最不重要的這科退掉，但來不及了......

期中考後我只去三次，這堂課幾乎每堂都會用系統點名，但有幾次沒點（然後我都有到），如果我從這裡拜到期末都沒缺課，那老師點名有到的次數和老師的點名次數比，差一點點就2/3，但如果用十八週去比
出席次數是超過2/3。

請問有人知道，這樣期末會被扣考嗎？

感謝各位",扣考,2020-12-13T20:50:17.990Z,2020-12-13T20:50:35.547Z,3,4,F
234976182,"沒關係
剛好今天有經過拍一整排機車，就再送你們一張人行道違停罰單，你們都有，人人有獎喔
https://i.imgur.com/dvinZ5P.jpg",安全帽被弄掉嗎,2020-12-13T16:55:27.414Z,2020-12-13T16:56:15.867Z,17,22,M
234975938,"幹 去樓下丟個垃圾剛出門口鼻子就被重擊

這味道到底哪來的",宿舍怎麼會有屎味啊,2020-12-13T16:19:16.992Z,2020-12-13T16:19:16.992Z,11,8,M
234975937,"為什麼現在低樓層的落地窗外有很臭的味道
有點像肥料味或雞屎味
前幾個禮拜有
今天又出現了",D棟誰在養雞,2020-12-13T16:19:12.499Z,2020-12-13T16:19:12.499Z,4,5,F
234975867,"https://i.imgur.com/dp567dT.jpg
查了103-108年度下學習的開課資訊，發現心理學（二）的限修人數是依教室決定，想請問109下學期的人數只有36人，外系生選上的機會是不是就不大了？謝謝！",下學期犯防系「心理學（二）」,2020-12-13T16:10:06.051Z,2020-12-13T16:10:06.051Z,2,4,F
234975214,"中正的同學大家好，我是諸羅祭的校園大使，喜歡聽團的朋友趕快找大使登記起來！
下一個覺醒音樂祭不要錯過了😝

🔥KKTIX上架🔥
在12/28會開放火雞票
每種票都是限量的呦
✨但想要輕鬆拿到便宜的票找大使就對了😌
（可以到官方ig精選和不分系找到我們的蹤影）

預祝各位購票愉快
要搶要快！別再錯過囉！
.
✅Facebook :諸羅祭 Jurassic Festival
❇️ Instagram: jurassicfestival

🎬日  期｜2021/04/10 - 04/11
📌地  點｜嘉義文化創意產業園區

📣演出陣容｜吳青原、王彙筑、生炒鴨肉羹 HJ Band、美秀集團、The Tic Tac、東波EastWave…and more

🏡主辦單位｜領悟音樂多媒體工作坊
🏡協辦單位｜上多利國際娛樂有限公司
🏡贊助單位｜中國信託文教基金會

#諸羅祭 #2021諸羅祭 #JurassicFestival
#嘉義大學 #NCYU #嘉義音樂祭 #嘉義 #音樂祭 #領悟起來  #領悟音樂多媒體工作坊 #嘉義文化創意產業園區 #吳青原 #王彙筑 #生炒鴨肉羹 #美秀集團 #thetictac #Eastwave

https://www.facebook.com/111503753596692/posts/401989794548085/?d=n",嘉義舉辦音樂祭！進入搶票倒數,2020-12-13T14:38:43.705Z,2020-12-13T14:44:55.074Z,5,7,F
234974901,請問有人填完教學調查後出現錯誤訊息的嗎？,線上教學意見調查,2020-12-13T13:55:54.860Z,2020-12-13T13:55:54.860Z,5,5,M
234974159,"為什麼中吃那麼多小鬼頭，恐 ಠ_ಠ
補字補字補字",［求解］小鬼頭們,2020-12-13T11:48:54.961Z,2020-12-13T11:48:54.961Z,10,7,F
234974100,"又是哪群猴子啊
叫那麼久香蕉來了沒
嗚吱吱吱
https://i.imgur.com/enXak6x.jpg",現在學校宿舍外面,2020-12-13T11:36:31.950Z,2020-12-13T11:36:31.950Z,5,12,M
234972880,"最強館長，謝謝您。
＜今週刊＞報導
【清寒學生全義務的大規模1對1家教】，翻轉弱勢孩子的命運/黃金山
（紙本＜今週刊＞明天出版上市）
https://www.facebook.com/BToday/videos/1001294273726233/",看到真的很感動，也很感謝所有為社會盡一份心的人,2020-12-13T07:23:07.389Z,2020-12-13T07:23:07.389Z,1,51,M
234972342,此篇文章為轉貼文章，請更新至最新版本觀看完整內容。,轉：台清交成政資工所/財金所跨領域推甄心得,2020-12-13T05:31:09.134Z,2020-12-13T05:31:09.134Z,9,23,M
234971760,B棟附近現在吵吵鬧鬧的 是有辦活動嗎,問個問題,2020-12-13T02:47:38.018Z,2020-12-13T02:47:38.018Z,11,4,M
234971108,"原文https://www.facebook.com/groups/581416968650997/permalink/3468617939930871/

《我是一篇被流浪狗攻擊的經驗文》

12/11（五）17:24在公園路行走的普通路人，但突然有一群流浪狗（至少5隻）從遠處（10～15公尺）突然奔來撲到我身上，賣命的咬我的大腿、小腿，過程我很害怕也沒做任何反擊，只會尖叫。事件結束後我覺得痛感很強烈，也很怕那群狗再次攻擊，所以立刻回家檢查傷口狀況，沒有立即尋求任何協助（例如：報警、尋求目擊者、立即就醫等）。

隔天有尋求豐收派出所的幫助，得知遇到具有攻擊性或是會追車的流浪狗時可以採取的方式，所以到板上和大家分享，也提供一些建議。

1、如果5年內沒有施打過破傷風疫苗，被流浪狗咬傷24小時內要儘速就醫。
（破傷風疫苗不是每個醫療院所都有，文末提供網址讓大家參考）

2、當遇到有攻擊性或會追車的流浪狗可以錄影、拍照，並聯繫強化精準捕捉專線：05-3620373
可能很多人當下很驚慌失措無法想到這件事情，但如果有巧遇的旁觀者也可以協助喔～
（捕捉的過程文末提供網址參考）

3、散步好像有點危險，建議大家晚上出門、單獨行動可以騎機車或開車，以確保人身安全。

本文純屬經驗分享，希望可以幫助到有需要的人！
感謝豐收派出所積極協助！
如果用詞或敘述有不妥處，請見諒😔

《網址》預防接種單位
https://www.cdc.gov.tw/Category/List/TcKynGco9G59NR02tsMyaQ

《網址》流浪狗捕捉收容程序
https://ldcc.cyhg.gov.tw/News_Content.aspx?n=EC87383FF86BA1AB&sms=8F21465DEFED393E&s=515AAD71B13B7DDA",有同學被狗圍攻了...,2020-12-12T19:09:54.258Z,2020-12-13T07:24:10.538Z,7,13,M
234970929,什麼時候會修好，小弟弟我我要交作業啊QQ,ecourse2,2020-12-12T18:13:21.805Z,2020-12-12T18:13:21.805Z,5,2,M
234970918,此篇文章為轉貼文章，請更新至最新版本觀看完整內容。,上熱門了同學…,2020-12-12T18:08:48.611Z,2020-12-12T18:08:48.611Z,12,32,M
234969717,"小弟我在不分系 看到說帶這隻狗去結紮之後
就沒看到了
想請問有人認領嗎或是被帶去哪裡了
https://i.imgur.com/sxz8hkO.jpg
https://i.imgur.com/XH76pbQ.jpg
https://i.imgur.com/XbkPNoL.jpg",三豐路的這隻狗去哪裡了,2020-12-12T14:47:41.679Z,2020-12-12T15:00:35.457Z,19,19,M
234968718,"下學期想搬凱12
想問問住戶居住的優缺點
另外熱水夠熱嗎我洗澡大概30分鐘",凱12,2020-12-12T11:51:09.834Z,2020-12-12T11:51:09.834Z,6,3,F
234968490,"各位評評理這樣像話嗎
到底是香香還是發發
https://i.imgur.com/Nb2w0uN.jpg",不對吧 沒在尊重的,2020-12-12T11:00:20.757Z,2020-12-12T11:00:20.757Z,15,27,M
234966506,"https://it.ccu.edu.tw/news_viewing.php?id=670

【網路維護】12/12(六)10:00~14:00對外網路暫停服務
各位好：

配合台灣學術網路(TANet)雲嘉區域網路中心骨幹路由器進行韌體升級作業，作業期間對外網路暫停服務，影響時間如下表，不便之處敬請見諒。


日　　期：12/12(六)
時　　間：10:00~14:00
工作事項：路由器韌體升級作業
影響範圍：本校對外網路服務中斷


資訊處 敬上",【網路維護】12/12(六)10:00~14:00對外網路暫停服務,2020-12-12T03:55:58.852Z,2020-12-12T03:55:58.852Z,1,7,M
234966467,"化工系那兩個很壯很矮，都坐在左前方的男生可以閉嘴了ㄇ
每天都在這 話講不停
怎麼不去租個討論室邊討論邊健身==",圖書館自習室,2020-12-12T03:49:14.893Z,2020-12-12T03:49:54.090Z,10,7,M
234966355,宿網滿格但完全跑不動網頁，有沒有人知道是怎麼回事？趕作業仔很痛苦,請問有人有跟我一樣的情況嗎？,2020-12-12T03:10:59.529Z,2020-12-12T03:10:59.529Z,16,4,F
234966232,請問各位大大，我下學期要修普物實驗(二)，但重修班的時間卡到系上的必修，所以我想加簽機械班的實驗，規定上是也需要修正課，但我普物二正課已經修完了，想問一下有沒有有類似經驗的人可以分享這樣的情況，這樣教授是否會給加簽只上實驗課就好。拜託各位有經驗的同學了,下學期普物實驗(二)加簽問題,2020-12-12T02:30:36.958Z,2020-12-12T02:30:36.958Z,6,4,M
234965264,"那麼晚了還在工作真的很辛苦
但希望可以把音樂放小聲一點🙏
本人住在附近而且有點睡眠障礙
希望大家可以互相體諒",辣脆腸老闆請進,2020-12-11T18:05:26.776Z,2020-12-11T18:07:06.531Z,6,16,F
234964569,"我是大一 ，
有想要雙主資工，然後他有一個條件是: 
先修本系「程式設計(一)」(3 學分)及「程式設計實習(一)」(1 學分)

剛才看了一下資工系下學期的課，
只有程式設計(二)、程式設計實習(二)...

這樣的話該怎麼辦呢
是只能等大二上學期再修了嗎

感謝",雙主資工先修,2020-12-11T16:09:44.459Z,2020-12-11T16:09:44.459Z,10,1,M
234964309,此篇文章為轉貼文章，請更新至最新版本觀看完整內容。,中天要關了 值得紀念的時刻,2020-12-11T15:35:06.721Z,2020-12-11T15:35:06.721Z,3,13,M
234964252,"剛剛看了一下預約系統，感覺滿多名字可以選的
有經驗的人可以講一下會不會有特別雷(講出的話會讓你感受不到同理心)的人嘛？

順便問一下，如果只是想要找人敘述現在的狀況(主要)或是聽建議，但是自己已經大致進行一次心情狀態的調整了，目前處於不怎麼急迫的狀況還會建議預約晤談嗎？",輔導中心晤談,2020-12-11T15:29:04.118Z,2020-12-11T15:29:04.118Z,6,1,M
234963401,有人知道仙草奶酪對面的烤鴨 是哪幾天會開嗎 喔還有 是幾點開始賣呢,大吃烤鴨開的時間,2020-12-11T13:20:23.452Z,2020-12-11T13:20:44.676Z,11,6,M
234963368,"小女子(T ^ T)住大吃全家附近已經連續兩天屋內都有隱翅蟲
想問各位住的地方狀況如何？
還有傳授一些抓蟲技巧ಥ_ಥ",隱翅蟲,2020-12-11T13:14:37.215Z,2020-12-11T14:35:25.952Z,16,7,F
234962902,"最近兩次回家都沒看到人 沒辦法買票
請問有南投人知道這邊還有在賣票嗎？
還是就只能排隊刷悠遊卡了⋯⋯

https://i.imgur.com/1jpmxJE.jpg",#問 台中客運草屯售票處,2020-12-11T11:57:07.866Z,2020-12-11T11:57:50.838Z,9,2,M
234962109,"https://kiki.ccu.edu.tw/~ccmisp06/Course/

剛剛發現下學期的開課資料公布了

第一階段的選課時間是12/25~12/31

過聖誕節之餘也要記得選課哦",109學年度第2學期課程表,2020-12-11T09:37:42.865Z,2020-12-11T09:38:19.257Z,18,91,F
234961031,"那個，
雖然之前板上吵得很兇，說個資外洩之後多了很多騷擾電話甚麼的，後來也是不了了之

但我個人也有類似的感覺，11月底到現在來了4-5通推銷電話，甚麼科學人還是奇怪的科技公司的都有，雖然沒法直接說原因就是個資外洩但想問大家有沒有類似的經驗。

拜託理性勿戰，我只想問問而已",電話推銷,2020-12-11T06:15:45.476Z,2020-12-11T06:15:45.476Z,18,9,M
234959505,"同學們大家好
請問一下學校附近或是民雄有哪間早餐店在賣這種香頌啊？
我家附近的弘爺有 但去了曾經是弘爺的百田看 他們卻沒有賣ಥ_ಥ
還請各位先進分享一下了
https://i.imgur.com/vEKS6gS.jpg",哪裡有賣香頌,2020-12-11T00:45:45.450Z,2020-12-11T00:45:45.450Z,5,3,M
234959077,三興路附近的車為啥最近每天都在叫，今天晚上已經叫第二次囉，真的是有夠吵，但我俗辣不敢發不分系啦！,汽車警示聲,2020-12-10T19:13:34.172Z,2020-12-10T19:13:34.172Z,7,7,F
234958522,"剛剛研究所宿舍突然一連串女生尖叫聲
不知道發生什麼事情
半夜一點多突然聽到
有人知道嗎..",宿舍慘叫,2020-12-10T17:25:04.245Z,2020-12-10T17:25:04.245Z,16,7,F
234957866,"你們是不是跟別人有什麼過節
怎麼有個很明顯是反串的想幫你們招黑啊？
https://i.imgur.com/wNLRWyY.png
https://i.imgur.com/QIFd311.jpg
https://i.imgur.com/kJzx4H2.png
https://i.imgur.com/RmTQz4p.png
https://i.imgur.com/O4MPmQ4.png
https://i.imgur.com/DHoPbMu.png
https://i.imgur.com/ArpFfCe.png

這個本來就是匿名社團 所以id我就不碼了
運競差點又要參一腳 還好沒真的被釣出來",自由搏擊社請進,2020-12-10T15:51:36.814Z,2020-12-10T17:20:38.047Z,5,8,M
234956919,"小弟想問一下有人住凱12 凱9  或富野的嗎
能分享一下居住的心得嗎
比較推薦哪一個？
（富野感覺不錯但聽了傳聞後就有點卻步

預算範圍都可以接受
比較想找像飯店式管理的那種有小裝潢的
還是有其他類似的地方可以推薦一下ㄉ",下學期租屋選擇,2020-12-10T13:45:26.038Z,2020-12-10T13:45:26.038Z,13,8,M
234956909,"今天無聊去大吃閒晃突然驚覺人也太少
星期四晚上整個大吃宛如空城
跟大一剛進來的時候差好多⋯⋯
雖然我自己也不太在大吃買晚餐、宵夜
但怎麼會兩三年就差這麼多吖？
真的是受外送平台的影響嗎
好奇大家的晚餐都怎麼解決的

剛剛還看到有人說A咖生意也沒那麼好了
想當初尖峰時期還要候位⋯⋯",大吃人潮,2020-12-10T13:44:46.592Z,2020-12-10T13:44:46.592Z,7,16,F
234956450,"請問中正附近或民雄、嘉義市區有推薦的洗鞋店家嗎
有比較貴的鞋想請專業一點的清洗",洗鞋店家,2020-12-10T13:06:54.562Z,2020-12-10T13:06:54.562Z,2,2,M
234956307,"幫朋友代po~

禮拜三晚上10.左右
在活中門口有一個數學碩二
有參加熱舞社的男生
看到我沒帶傘😢
就人很好的撐傘送我到家
我想向你道謝
祝你熱舞成發順利~
希望你能看到這篇文章
或是他的朋友可以幫忙轉達😂",［尋人］雨天送暖男,2020-12-10T12:44:54.570Z,2020-12-10T12:44:54.570Z,11,18,F
234955712,"今天晚上在活中二樓階梯平台跳舞的那群人有事嗎
該不會又是把全校當自己家的熱舞社吧？",活中二樓樓梯平台,2020-12-10T11:04:01.045Z,2020-12-10T11:04:01.045Z,4,6,F
234954675,"https://i.imgur.com/Nj00zCY.jpg
https://i.imgur.com/Ajm1yah.jpg
https://i.imgur.com/nEhubsy.jpg
來源：104人力銀行
截至目前日期12／02

樣本數：
義守電機電子所113筆
中正機械所123筆
中正化工所74筆

早知道報名義守大學了QQ",憾！義守電機所薪水待遇＝中正機械所／化工所,2020-12-10T08:07:31.630Z,2020-12-10T08:23:35.387Z,11,9,M
234954380,"最近看到幾篇關於便利商店的文章，想知道大家對學校附近的便利商店的評價如何？
個人最常去的是大吃的7-11跟全家，兩間都不錯，但全家員工有時服務態度會比較差，7-11服務態度不錯，但晚上人很多，有時候結帳需要等幾分鐘（純屬個人觀感）

不知道宿舍前面兩間態度怎樣🧐",中正便利商店,2020-12-10T07:10:33.704Z,2020-12-10T07:10:33.704Z,10,16,M
234953444,"不好意思，最近身體狀況不好，睡覺的時候只要有人大聲走動，關門，拉椅子，喧嘩，基本上都很容易讓我驚醒(在戴著耳機的情況下)
可以麻煩大家在宿舍區活動的時候小聲一點，要期末考了，我想早點把病養好
謝謝大家",麻煩10點後安靜一點 拜託,2020-12-10T04:28:30.476Z,2020-12-10T04:28:30.476Z,16,22,F
234951719,"剛剛到現在 有個女的一直大喊我不要我不要
控制一下 別再慘叫了 很恐怖",凱12是要出人命了是不是,2020-12-09T17:42:32.571Z,2020-12-09T17:42:32.571Z,21,15,M
234951653,"麻煩大家不管住哪裡關門都請小力好嗎？
菁華的各位：
門到底和你們有什麼仇？房東都發過公告請大家關門放輕力道了，大家還是喜歡在半夜比誰關門比較大聲，考慮其他住戶很難嗎^_^",關門請小力,2020-12-09T17:29:45.202Z,2020-12-09T17:29:45.202Z,9,18,F
234950891,"（告白中正好像又倒了 所以來這裡發廢文～）

最近兩次去七里香買飲料，都覺得姐姐超可愛的☺️每次跟她講話都好害羞哈哈哈哈

各位宅宅比較喜歡果真姐姐還是七里香姐姐呀～",告白七里香姐姐～,2020-12-09T15:36:53.474Z,2020-12-09T15:36:53.474Z,10,16,M
234949396,"我在冷漠小屋看到的
2ㄏ2ㄏ
是真的還假的啊？
有沒有八卦？",聽說溫暖小屋倒了喔？,2020-12-09T12:05:44.458Z,2020-12-09T12:05:44.458Z,5,5,M
234949355,"態度到底在差什麼意思的

我自認對店員很有禮貌
請、謝謝、不好意思 都掛嘴邊那種

但大吃全家晚班店員還是不知道為什麼要那麼跩
講話都好像我欠她五億

跟其他店員聊天說說笑笑
轉頭對客人就跩個二五八萬
到底是三小

態度差到我連結完帳的謝謝都懶得講



原本以為對面開了小7他們態度會好一點
沒想到好沒多久又打回原形⋯



早班短髮姊姊最讚惹～(˶‾᷄ ⁻̫ ‾᷅˵)",大吃全家晚班店員,2020-12-09T11:58:58.808Z,2020-12-09T11:58:58.808Z,38,55,F
234949088,"Q:哪一個地方冬天比夏天還熱呢 各位同學
A:中正大學圖書館！
為什麼每次天一冷就不開冷氣 這樣圖書館裡面就會變超悶跟超熱= =
超煩 錢可以不要省在這裡嗎
有人有同感嗎QAQ",圖書館冷氣 空調,2020-12-09T11:08:26.545Z,2020-12-09T11:08:26.545Z,10,16,M
234948754,"大家好!

想請問在就學貸款時有申請生活費何時會入帳呢?

因為到現在都還沒收到不知道是不是還沒審核過

再麻煩各位解答了謝謝!",生活費入帳時間,2020-12-09T10:15:49.293Z,2020-12-09T10:15:49.293Z,6,4,M
234948649,"到底是誰在唱歌 五點多
吵死了 有夠難聽 你媽真的沒告訴你你沒有唱歌的天分嗎 我等等要出去ㄧ間一間巡了",A棟九樓唱歌,2020-12-09T09:57:05.421Z,2020-12-09T09:57:05.421Z,9,1,M
234948397,"菜雞如我
今天想說去活中領教一下
學校的理髮機能
他媽ㄉ有夠雷
我跟理髮阿姨講的超仔細
他還是剪的怪裡怪氣
甚至，後面來了另一位客人
他為了趕緊接客
用梳子梳我頭髮時
直接用扯的 然後剪個三兩下跟我說好了
？？？？？？？？？？
他媽的有夠爛 三小服務態度
可撥沒生意

後來他越剪越隨便
我開始擔心害怕
就儘快順著理髮阿姨的意
跟他說沒關係這樣就好了
我就趕緊付錢閃人
有夠害怕被他剪到毀容",活中 時尚理髮有夠雷,2020-12-09T09:14:38.425Z,2020-12-09T09:43:58.804Z,13,13,M
234947278,"偉大的教授，守時是基本的原則，上課時間1:15，每次看你都快兩點或者超過兩點才到，你知道有多少人在等待？浪費多少人的時間嗎？ 
不要每次都有藉口說為什麼遲到，什麼量子電腦很厲害，就算量子電腦速度有多快，你還是遲到慢的跟什麼一樣
成功的人只找方法。",控制系統 教授知道他的上課時間嗎？,2020-12-09T05:55:09.852Z,2020-12-09T09:59:16.634Z,12,15,M
234946598,"更
確定是助教薪水
但健保也扣太多了吧🥺🥺心好痛

剛剛對帳了一下
有一筆1810元的，但助教十月薪水不是2054嗎
不確定是助教的薪水，還是在別的處室打工的錢
還是有扣健保？",#問 助教薪水大家拿到了嗎,2020-12-09T03:37:30.301Z,2020-12-09T04:19:17.643Z,9,13,F
234943392,"有人晚上要一起跑步嗎??
在學校附近或是操場都可以

一個人有點難以常常堅持",晚上跑步,2020-12-08T13:15:39.455Z,2020-12-08T13:15:39.455Z,22,13,M
234943370,住大吃發現外面一直有好像是消防車還是救護車的聲音，是what happened?,［發問］消防車嗎？,2020-12-08T13:13:12.173Z,2020-12-08T13:13:12.173Z,4,3,F
234942423,"今天去泰麻吉
想說看起來沒什麼人，買個便當要回家吃
結果點完以後等了半個小時
老闆還是一樣在做電話訂單的..
我覺得現場不優先就算了
但如果要等一大堆單應該要先講一下吧==",泰麻吉,2020-12-08T10:38:54.859Z,2020-12-08T10:38:54.859Z,7,8,M
234942000,"大吃全家後面的壽司攤
有人吃過能分享好不好吃ㄇ",大吃壽司,2020-12-08T09:31:27.331Z,2020-12-08T09:31:27.331Z,11,3,M
234941770,"進到圖書館一堆人直接把口罩拿下來
然後就開始咳嗽、擤鼻涕
那要出入戴口罩有什麼用啊==
也要有人在圖書館裡面監督吧
還是台灣就是這樣
做事就做一半
有個形式就好

來圖書館繞個幾圈
至少幾十個人沒戴著口罩
檢舉有沒有錢啊？
有的話我光是拿手機繞圖書館2～8樓
我下個月就能住帝寶了欸",進圖書館就不用戴口罩了！？,2020-12-08T08:51:17.070Z,2020-12-08T08:51:17.070Z,19,27,M
234941609,請問有人有拍過大門停車場前面路口（富農路）野狗追車/人的畫面嗎，剛剛打去嘉義縣政府捕狗機構，他們說需要有實際拍攝畫面才能夠來抓捕。小弟在這邊被狗追了好幾次，雖然每次回頭他們就退掉，但應該還是會有怕狗的騎過去被追導致受傷，所以想請嘉義縣政府幫忙處理。,大門停車場前面路口的狗,2020-12-08T08:24:08.171Z,2020-12-08T08:24:08.171Z,8,15,M
234940811,"https://i.imgur.com/NA8BJu1.jpg

即將開幕... 新的...
平價... 吼勾... 牛排...
不知道... 好不好... 吃...
雞肉飯... 終究... 還是...
撐... 不下去...",吼勾牛排,2020-12-08T05:54:35.078Z,2020-12-08T05:54:35.078Z,19,45,M
234940278,"大家平常習慣去哪裡剪髮?
小弟剛來中正，先試試看連鎖店PS
乾...真的超雷
每個朋友都說很怪
雖然剪完當下有跟我說不滿意還可以來修
過兩天受不了回去想修
但她卻說要重新計價
真TM的 #@$^**%#
(身材微寬臉微腫的那位女理髮師)",小心民雄PS,2020-12-08T04:07:21.204Z,2020-12-08T04:07:21.204Z,20,8,M
234940161,"不知道大家還有沒有印象
嘻嘻 幸好我都不喝豆漿的
https://www.ettoday.net/news/20201208/1871614.htm?from=fb_et_news&fbclid=IwAR3bZkW3pCrEf2GDm4QSElnHrrAUbxckIGJys4tOcrDjBy9YCV7TRzIN9eo",好喝的豆漿,2020-12-08T03:42:28.900Z,2020-12-08T03:42:28.900Z,8,76,M
234938976,"欸欸兄弟 你一個男的賣洗衣球干嘛約cd棟外面啊 是跟你從別人手裡搶來的女朋友約會順便交貨嗎？ 那幹嘛不約田徑場看台勒 還是寧靜湖畔也不錯啊 順便跟你講
她口技很不錯喔",懂賣,2020-12-07T18:07:25.141Z,2020-12-07T18:07:25.141Z,16,6,M
234938230,"有人也住彬彬然後網路掛掉的嗎
期中考沒網路很幹欸
最近網路一直出問題
而且樓下為什麼突然多了一堆大水塔",彬彬網路,2020-12-07T15:58:54.862Z,2020-12-07T15:58:54.862Z,16,3,M
